{
  "log": {
    "loglevel": "warning"
  },
  "inbounds": [
    {
      "tag": "socks",
      "port": 10808,
      "listen": "127.0.0.1",
      "protocol": "socks",
      "settings": {
        "auth": "noauth",
        "udp": true
      }
    },
    {
      "tag": "http",
      "port": 10809,
      "listen": "127.0.0.1",
      "protocol": "http"
    }
  ],
  "outbounds": [
    {
      "tag": "proxy",
      "protocol": "vmess",
      "settings": {
        "vnext": [
          {
            "address": "YOUR_SERVER",
            "port": 443,
            "users": [
              {
                "id": "REPLACE_ME",
                "alterId": 0,
                "security": "auto"
              }
            ]
          }
        ]
      },
      "streamSettings": {
        "network": "ws",
        "security": "tls",
        "tlsSettings": {
          "serverName": "YOUR_SERVER",
          "allowInsecure": false
        },
        "wsSettings": {
          "path": "/",
          "headers": {
            "Host": "YOUR_SERVER"
          }
        }
      }
    },
    {
      "tag": "direct",
      "protocol": "freedom"
    },
    {
      "tag": "block",
      "protocol": "blackhole"
    }
  ],
  "routing": {
    "domainStrategy": "IPIfNonMatch",
    "rules": [
      {
        "type": "field",
        "ip": ["geoip:private"],
        "outboundTag": "direct"
      },
      {
        "type": "field",
        "domain": ["geosite:category-ads-all"],
        "outboundTag": "block"
      }
    ]
  }
}
