{
  "log": {
    "loglevel": "warning"
  },
  "inbounds": [
    {
      "tag": "socks",
      "port": 10808,
      "listen": "127.0.0.1",
      "protocol": "socks",
      "settings": {
        "auth": "noauth",
        "udp": true
      }
    },
    {
      "tag": "http",
      "port": 10809,
      "listen": "127.0.0.1",
      "protocol": "http"
    }
  ],
  "outbounds": [
    {
      "tag": "proxy",
      "protocol": "vless",
      "settings": {
        "vnext": [
          {
            "address": "YOUR_SERVER",
            "port": 443,
            "users": [
              {
                "id": "REPLACE_ME",
                "flow": "xtls-rprx-vision",
                "encryption": "none"
              }
            ]
          }
        ]
      },
      "streamSettings": {
        "network": "tcp",
        "security": "reality",
        "realitySettings": {
          "serverName": "www.apple.com",
          "fingerprint": "chrome",
          "publicKey": "REPLACE_PUBLIC_KEY",
          "shortId": "REPLACE_SHORT_ID"
        }
      }
    },
    {
      "tag": "direct",
      "protocol": "freedom"
    },
    {
      "tag": "block",
      "protocol": "blackhole"
    }
  ],
  "routing": {
    "domainStrategy": "IPIfNonMatch",
    "rules": [
      {
        "type": "field",
        "ip": ["geoip:private"],
        "outboundTag": "direct"
      },
      {
        "type": "field",
        "domain": ["geosite:category-ads-all"],
        "outboundTag": "block"
      }
    ]
  }
}
