{
  "log": {
    "loglevel": "warning"
  },
  "inbounds": [
    {
      "tag": "socks",
      "port": 10808,
      "listen": "127.0.0.1",
      "protocol": "socks",
      "settings": {
        "auth": "noauth",
        "udp": true
      }
    },
    {
      "tag": "http",
      "port": 10809,
      "listen": "127.0.0.1",
      "protocol": "http"
    }
  ],
  "outbounds": [
    {
      "tag": "PROXY_TAG",
      "protocol": "freedom"
    },
    {
      "tag": "direct",
      "protocol": "freedom"
    },
    {
      "tag": "block",
      "protocol": "blackhole"
    }
  ],
  "routing": {
    "domainStrategy": "IPIfNonMatch",
    "rules": [
      {
        "type": "field",
        "port": "443",
        "network": "udp",
        "outboundTag": "block"
      },
      {
        "type": "field",
        "ip": [
          "geoip:private"
        ],
        "outboundTag": "direct"
      },
      {
        "type": "field",
        "domain": [
          "geosite:category-ads-all"
        ],
        "outboundTag": "block"
      },
      {
        "type": "field",
        "domain": [
          "geosite:geolocation-!cn"
        ],
        "outboundTag": "PROXY_TAG"
      }
    ]
  }
}
